{
  "@id": "https://doi.org/TEST/WDR-Y9G-2AY",
  "@type": "VirtualCollection",
  "dcterms:identifier": "https://doi.org/TEST/WDR-Y9G-2AY",
  "ods:fdoType": "https://hdl.handle.net/21.T11148/2ac65a933b7a0361b651",
  "ods:status": "Active",
  "schema:version": 1,
  "ltc:collectionName": "Holotypes Botany Collection",
  "ltc:description": "A virtual collection of specific botanical holotypes. Excluding the Naturalis collections.",
  "ltc:basisOfScheme": "Reference Collection",
  "schema:contentURL": "https://image.bgbm.org/images/internal/HerbarThumbs/B100272813_1700",
  "schema:dateCreated": "2025-03-01T12:00:00.323Z",
  "schema:creator": {
    "@id": "https://orcid.org/0000-0002-5669-2769",
    "@type": "schema:Person",
    "schema:name": "Sam Leeflang",
    "ods:hasIdentifiers": [
      {
        "@id": "https://orcid.org/0000-0002-5669-2769",
        "@type": "ods:Identifier",
        "dcterms:title": "ORCID",
        "dcterms:type": "URL",
        "dcterms:identifier": "https://orcid.org/0000-0002-5669-2769",
        "ods:gupriLevel": "GloballyUniqueStablePersistentResolvable",
        "ods:identifierStatus": "Preferred"
      }
    ]
  },
  "ods:hasTargetDigitalObjectFilter": {
    "ods:predicateType": "and",
    "ods:hasPredicates": [
      {
        "ods:predicateType": "in",
        "ods:predicateKey": "$['ods:id']",
        "ods:predicateValues": ["https://doi.org/10.15468/holotype1", "https://doi.org/10.15468/holotype2"]
      },
      {
        "ods:predicateType": "not",
        "ods:predicateKey": "$['ods:organisationID']",
        "ods:predicateValue": "https://ror.org/0566bfb96"
      }
    ]
  }
}